{
  "$schema": "https://json-schema.org/draft/2020-12/schema",
  "$id": "vantagenode-x/schemas/copy.schema.json",
  "title": "03_copy.json — saída do VOICE (03)",
  "description": "Texto do post + primeiro reply. Link permitido no corpo do post ou no reply (invariante 3, decisão do Gui 25/07/2026). Voz humanizada e acessível, sem emoji/hype e sem travessão em dash (invariante 8).",
  "type": "object",
  "additionalProperties": false,
  "required": ["cycle_id", "post", "numbers", "reading", "single_idea", "no_hype_check"],
  "properties": {
    "cycle_id": { "type": "string" },
    "version": { "type": "string", "description": "Opcional. Marca versões/rascunhos de reescrita (ex.: 'v2-voz-humanizada')." },
    "note": { "type": "string", "description": "Opcional. Proveniência/observação livre (ex.: rascunho não publicado, motivo da reescrita)." },
    "post": {
      "type": "object",
      "additionalProperties": false,
      "required": ["text", "char_count"],
      "properties": {
        "text": { "type": "string", "maxLength": 280, "description": "Corpo do post. Pode conter link (invariante 3, decisão do Gui 25/07/2026). Sem travessão em dash (invariante 8)." },
        "char_count": { "type": "integer", "maximum": 280, "description": "Contagem crua de code points do texto (referência interna)." },
        "char_count_x": { "type": "integer", "maximum": 280, "description": "Opcional. Contagem como o X conta: URLs valem 23 (t.co), independentemente do tamanho real. É esta que precisa caber em 280." },
        "link": { "type": "string", "description": "Link presente no corpo do post, se houver (permitido desde 25/07/2026). Ausente se o post não tiver link no corpo." }
      }
    },
    "reply": {
      "type": "object",
      "additionalProperties": false,
      "description": "Primeiro reply. OPCIONAL desde 25/07/2026: com link permitido no corpo, um post pode ir sozinho, sem reply. Se presente, exige text.",
      "required": ["text"],
      "properties": {
        "text": { "type": "string", "maxLength": 280 },
        "link": { "type": "string", "description": "Link do reply, se o link for nesse lugar. Desde 25/07/2026 o link também pode ir no corpo do post (invariante 3). Ausente se não houver link no reply." }
      }
    },
    "numbers": {
      "type": "array",
      "description": "Todo número afirmado no texto, para o GATEKEEPER cruzar com gráfico e fonte (invariante 6).",
      "items": {
        "type": "object",
        "additionalProperties": false,
        "required": ["value", "unit", "where", "claim"],
        "properties": {
          "value": { "type": "number" },
          "unit": { "type": "string" },
          "where": { "type": "string", "enum": ["post", "reply", "chart"] },
          "claim": { "type": "string", "description": "A afirmação em que o número aparece." }
        }
      }
    },
    "reading": { "type": "string", "description": "A leitura/interpretação que acompanha o dado (invariante 4). Nunca dado cru." },
    "single_idea": { "type": "boolean", "description": "Invariante 1." },
    "link_in_reply_only": { "type": "boolean", "description": "Campo legado da invariante 3. Desde 25/07/2026 o link pode ir no corpo do post OU no reply, então isto virou informativo (onde o link ficou), não mais um requisito. true = link só no reply; false = link no corpo (ou em ambos)." },
    "bookmark_test": { "type": "string", "description": "Resposta à pergunta 'um analista salvaria isto?' (invariante 2)." },
    "no_hype_check": { "type": "boolean", "description": "Sem emoji, sem hype, sem jargão de lua/pump e sem travessão em dash (invariante 8)." }
  }
}
