{
  "cycle_id": "2026-07-20-mvrv-cohort-01",
  "post": {
    "text": "O MVRV agregado em 1,208 sugere 'mercado no lucro' — mas por coorte a leitura se divide. Long-term holders: 1,284, no azul. Short-term holders: 0,933, cerca de 6,7% abaixo do custo. O lucro está nas mãos antigas; quem comprou recente está no vermelho há semanas.",
    "char_count": 262
  },
  "reply": {
    "text": "MVRV por coorte = valor de mercado ÷ custo-base de cada grupo. Abaixo de 1 = no prejuízo. O lado STH é confirmado por NUPL-STH (−0,072) e SOPR-STH (0,9849). Fonte (MVRV, VantageNode): https://vantagenode.io/terminal — não é previsão de preço.",
    "link": "https://vantagenode.io/terminal"
  },
  "numbers": [
    {
      "value": 1.208,
      "unit": "ratio",
      "where": "post",
      "claim": "MVRV agregado em 1,208"
    },
    {
      "value": 1.284,
      "unit": "ratio",
      "where": "post",
      "claim": "Long-term holders: 1,284"
    },
    {
      "value": 0.933,
      "unit": "ratio",
      "where": "post",
      "claim": "Short-term holders: 0,933"
    },
    {
      "value": 6.7,
      "unit": "%",
      "where": "post",
      "claim": "cerca de 6,7% abaixo do custo (derivado de 1 − 0,933)"
    },
    {
      "value": -0.072,
      "unit": "ratio",
      "where": "reply",
      "claim": "confirmado por NUPL-STH (−0,072)"
    },
    {
      "value": 0.9849,
      "unit": "ratio",
      "where": "reply",
      "claim": "SOPR-STH (0,9849)"
    }
  ],
  "reading": "O MVRV agregado (1,208) esconde uma divergência de coorte: o lucro está concentrado nos long-term holders (1,284), enquanto os short-term holders estão abaixo do custo-base (0,933, ~6,7% no vermelho). Quem comprou recentemente carrega prejuízo não realizado — um estado persistente (semanas), não ruído diário. Descreve posicionamento de custo, sem afirmar direção de preço.",
  "single_idea": true,
  "link_in_reply_only": true,
  "bookmark_test": "Sim — a leitura por coorte que o MVRV agregado e o gráfico de preço escondem; um analista salvaria como marcador de quem está sob stress agora.",
  "no_hype_check": true
}
